{
  "checked_at": "2026-06-26T11:58:16Z",
  "command_id": "echo-proof-001",
  "head_sha": "90c535e562ad7f7545403702e560f0a6c7d673be",
  "output_path": "agent-state/last-result.json",
  "repository": "grahama1970/chatgpt-lab",
  "run_attempt": 1,
  "run_id": 28236539862,
  "schema": "chatgpt_lab.workflow_result.v1",
  "status": "PASS",
  "stderr": "",
  "stdout": "hello from ChatGPT-Lab agent-dispatch",
  "workflow": "agent-dispatch.yml"
}
